{"$schema":"https://json-schema.org/draft/2020-12/schema","$id":"https://axignal.com/schemas/regulatory-market-entry-workspace-cases.schema.json","title":"P10 Regulatory Market Entry Workspace Adversarial Matrix","type":"object","additionalProperties":false,"required":["schema_version","task_id","scopes","threats","expected_case_count","canonical_delta","external_filing_delta"],"properties":{"schema_version":{"const":"axignal.regulatory-market-entry-workspace-cases/v0.1"},"task_id":{"const":"AX-GE2E-P10-T01"},"scopes":{"type":"array","minItems":9,"maxItems":9,"uniqueItems":true,"items":{"enum":["INSTRUMENT_REGISTRY","AUTHORITY_JURISDICTION","APPLICABILITY_OBLIGATION","CONSULTATION_TRANSITION","MARKET_ENTRY_WORKSPACE","COMPLIANCE_CONTROL","AUTHORISATION_FILING","ENFORCEMENT_OUTCOME","CROSS_MODULE"]}},"threats":{"type":"array","minItems":8,"maxItems":8,"items":{"type":"object","additionalProperties":false,"required":["threat","expected_decision","reason_code"],"properties":{"threat":{"enum":["STALE_OR_REPEALED_VERSION","NON_BINDING_AS_BINDING","SCOPE_OR_THRESHOLD_INFERENCE","MISSING_OR_CONTESTED_EVIDENCE","RIGHTS_REVOKED","CROSS_TENANT_REFERENCE","AUTHORITY_ESCALATION","FABRICATED_EXTERNAL_OUTCOME"]},"expected_decision":{"enum":["DENY","REVIEW_REQUIRED","BLOCK","QUARANTINE"]},"reason_code":{"type":"string","pattern":"^[A-Z0-9_]+$"}}}},"expected_case_count":{"const":72},"canonical_delta":{"const":0},"external_filing_delta":{"const":0}}}