{"schema_version":"axignal.regulatory-market-entry-workspace-cases/v0.1","task_id":"AX-GE2E-P10-T01","scopes":["INSTRUMENT_REGISTRY","AUTHORITY_JURISDICTION","APPLICABILITY_OBLIGATION","CONSULTATION_TRANSITION","MARKET_ENTRY_WORKSPACE","COMPLIANCE_CONTROL","AUTHORISATION_FILING","ENFORCEMENT_OUTCOME","CROSS_MODULE"],"threats":[{"threat":"STALE_OR_REPEALED_VERSION","expected_decision":"DENY","reason_code":"STALE_OR_REPEALED_INSTRUMENT"},{"threat":"NON_BINDING_AS_BINDING","expected_decision":"DENY","reason_code":"NON_BINDING_MATERIAL_ESCALATION"},{"threat":"SCOPE_OR_THRESHOLD_INFERENCE","expected_decision":"REVIEW_REQUIRED","reason_code":"UNSUPPORTED_SCOPE_OR_THRESHOLD"},{"threat":"MISSING_OR_CONTESTED_EVIDENCE","expected_decision":"REVIEW_REQUIRED","reason_code":"CRITICAL_EVIDENCE_UNRESOLVED"},{"threat":"RIGHTS_REVOKED","expected_decision":"DENY","reason_code":"SOURCE_RIGHTS_DENIED"},{"threat":"CROSS_TENANT_REFERENCE","expected_decision":"BLOCK","reason_code":"CROSS_TENANT_AUTHORITY_DENIED"},{"threat":"AUTHORITY_ESCALATION","expected_decision":"DENY","reason_code":"AUTHORITY_ESCALATION_DENIED"},{"threat":"FABRICATED_EXTERNAL_OUTCOME","expected_decision":"QUARANTINE","reason_code":"EXTERNAL_OUTCOME_NOT_OBSERVED"}],"expected_case_count":72,"canonical_delta":0,"external_filing_delta":0}